<!DOCTYPE skills [

<!ELEMENT skills (skill+)>
<!ELEMENT skill (name,fields,apt,defaulting,category+)>
<!ELEMENT name (#PCDATA)>
<!ELEMENT description (#PCDATA)>
<!ELEMENT fields (#PCDATA)>
<!ELEMENT apt (#PCDATA)>
<!ELEMENT defaulting (#PCDATA)>
<!ELEMENT category (#PCDATA)>

]>